NUM,NAME_2021,EXISTE_2021,NAME_2022,EXISTE_2022,DESCRIPTION,SOURCE,WEBSITE,LEVEL,NAME_2023,EXISTE_2023,NAME_2024,EXISTE_2024,NAME_2025,EXISTE_2025,TYPE,PROFILE,NOTAS_CAMBIO
5.2.2,State of cluster development and depth†,1,,0,"Based on the survey question: In your country, how widespread are well-developed and deep clusters (geographic concentrations of firms, suppliers, producers of related products and services, and specialized institutions in a particular field)?","World Economic Forum, Executive  Opinion Survey 2020.",www3.weforum.org/docs/WEF_TheGlobalCompetitivenessReport2020.pdf,,,0,,0,,0,surveyIndicator,Score,
5.2.3,"GERD financed by abroad, % GDP",1,,0,"Percentage of gross expenditure on R&D financed by abroad—that is, with foreign financing as a percentage of GDP.",UNESCO Institute for Statistics; Eurostat; and OECD.,http://data.uis.unesco.org; https://ec.europa.eu/eurostat/data/database; https://stats.oecd.org/Index.aspx?DataSetCode=MSTI_PUB,,,0,,0,,0,hardIndicator,Value,
5.2.4,Joint venture/strategic alliance deals/bn PPP$ GDP,1,,0,The number of joint ventures and strategic alliances deals made (fractional counting by each company participating in a deal) per billion PPP$ GDP.,"Refinitive, SDC Platinum database.",https://www.refinitiv.com/en/financial-data/deals-data/joint-venture-deals,,,0,,0,,0,hardIndicator,Value,
5.2.5,Patent families/bn PPP$ GDP,1,,0,Number of patent families filed in at least two offices by residents of an economy.,"World Intellectual Property Organization, Intellectual Property Statistics.",www.wipo.int//ipstats/,,,0,,0,,0,hardIndicator,Value,
5.3.,Knowledge absorption,1,,0,Sub-pillar on an economy's knowledge absorption capacity,Global Innovation Index,https://www.globalinnovationindex.org/analysis-indicator,,,0,,0,,0,Sub-Pillar,Score,
5.3.1,"Intellectual property payments, % total trade",1,,0,Charges for the use of intellectual property as a percent of total trade.,"World Trade Organization, Trade in Commercial Services database, values based on the classification of the sixth (2009) edition of the International Monetary Fund’s Balance of Payments and International Investment Position Manual and Balance of Payments database.",https://www.imf.org/external/pubs/ft/bop/2007/pdf/bpm6.pdf; www.oecd.org/std/its/EBOPS-2010.pdf,,,0,,0,,0,hardIndicator,Value,
5.3.2,"High-tech imports, % total trade",1,,0,High-technology imports as a percentage of total trade.,"World Trade Organization, United Nations, Comtrade Database; Eurostat, Annex 5: High-tech aggregation by SITC Rev. 4, April 2009.",http://comtrade.un.org; http://ec.europa.eu/eurostat/cache/metadata/Annexes/htec_esms_an5.pdf,,,0,,0,,0,hardIndicator,Value,
5.3.3,"ICT services imports, % total trade",1,,0,"Telecommunications, computer and information services imports as a percentage of total trade.","World Trade Organization, Trade in Commercial Services database, values based on the classification of the sixth (2009) edition of the International Monetary Fund’s Balance of Payments and International Investment Position Manual and Balance of Payments database.",https://www.imf.org/external/pubs/ft/bop/2007/pdf/bpm6.pdf; www.oecd.org/std/its/EBOPS-2010.pdf,,,0,,0,,0,hardIndicator,Value,
5.3.4,"FDI net inflows, % GDP",1,,0,"This data series shows net inflows (new investment inflows less disinvestment) in the reporting economy from foreign investors, and is divided by GDP.","International Monetary Fund, International Financial Statistics and Balance of Payments databases, World Bank, International Debt Statistics, and World Bank and OECD GDP estimates; extracted from the World Bank’s World Development Indicators database.",http://data.worldbank.org,,,0,,0,,0,hardIndicator,Value,
5.3.5,"Research talent, % in businesses",1,,0,"The full-time equivalence (FTE) of researchers in the business enterprise sector engaged in the conception or creation of new knowledge, products, processes, methods, and systems, as well as in the management of these projects, broken down by the sectors in which they are employed.",UNESCO Institute for Statistics; Eurostat; and OECD.,http://data.uis.unesco.org; https://ec.europa.eu/eurostat/data/database; https://stats.oecd.org/Index.aspx?DataSetCode=MSTI_PUB,,,0,,0,,0,hardIndicator,Value,
6.1.,Knowledge creation,1,,0,Sub-pillar on knowledge creation,Global Innovation Index,https://www.globalinnovationindex.org/analysis-indicator,,,0,,0,,0,Sub-Pillar,Score,
6.1.1,Patents by origin/bn PPP$ GDP,1,,0,Number of resident patent applications filed at a given national or regional patent office per billion PPP$ GDP.,"World Intellectual Property Organization, Intellectual Property Statistics.",www.wipo.int/ipstats,,,0,,0,,0,hardIndicator,Value,
6.1.2,PCT patents by origin/bn PPP$ GDP,1,,0,Number of international patent applications filed by residents at the Patent Cooperation Treaty per billion PPP$ GDP.,"World Intellectual Property Organization, Intellectual Property Statistics.",www.wipo.int/ipstats,,,0,,0,,0,hardIndicator,Value,
6.1.3,Utility models by origin/bn PPP$ GDP ,1,,0,Number of utility model applications filed by residents at the national patent office per billion PPP$ GDP.,"World Intellectual Property Organization, Intellectual Property Statistics.",www.wipo.int/ipstats,,,0,,0,,0,hardIndicator,Value,
6.1.4,Scientific and technical articles/bn PPP$ GDP,1,,0,Number of scientific and technical journal articles published per billion PPP$ GDP.,"Clarivate, Web of Science.",https://clarivate.com/webofsciencegroup/solutions/web-of-science,,,0,,0,,0,hardIndicator,Value,
6.1.5,Citable documents H-index,1,,0,The H-index is an economy's number of published articles (H) that have received at least H citations.,SCImago (2021) SJR - SCImago Journal & Country Rank.,www.scimagojr.com,,,0,,0,,0,hardIndicator,Score,
6.2.,Knowledge impact,1,,0,Sub-pillar on knowledge impact.,Global Innovation Index,https://www.globalinnovationindex.org/analysis-indicator,,,0,,0,,0,Sub-Pillar,Score,
6.2.1,"Labor productivity growth, %",1,,0,"Growth rate of real GDP per person employed, which provides a measure of labor productivity (defined as output per unit of labor input).","The Conference Board Total Economy Database™ Output, Labor and Labor Productivity.",https://www.conference-board.org/data/economydatabase,,,0,,0,,0,hardIndicator,Value,
6.2.2,New businesses/th pop. 15–64,1,,0,"Number of newly registered corporations per 1,000 persons of working-age (15–64 years old).","World Bank, Doing Business 2020.",https://www.doingbusiness.org/en/data/exploretopics/entrepreneurship,,,0,,0,,0,hardIndicator,Value,
6.2.3,"Software spending, % GDP",1,,0,"Computer software spending as a percentage of GDP. Computer software spending includes the total value of purchased or leased packaged software, such as operating systems, database systems, programming tools, utilities and applications.","IHS Markit, Information and Communication Technology Database.",https://www.ihs.com/index.html,,,0,,0,,0,hardIndicator,Value,
6.2.4,ISO 9001 quality certificates/bn PPP$ GDP,1,,0,"Number of ISO 9001 certificates issued, per billion PPP$ GDP. A ISO 9001 certificate demonstrates an organization's ability to provide products and services that meet both customer and applicable statutory and regulatory requirements.","International Organization for Standardization (ISO), ISO Survey of Certifications to Management System Standards.",https://www.iso.org/the-iso-survey.html,,,0,,0,,0,hardIndicator,Value,
6.2.5,"High-tech manufacturing, %",1,,0,High-technology and medium-high-technology output as a percentage of total manufacturing output.,"United Nations Industrial Development Organization,(UNIDO), Industrial Statistics Database.",https://stat.unido.org,,,0,,0,,0,hardIndicator,Value,
6.3.,Knowledge diffusion,1,,0,Sub-pillar on the diffusion of knowledge.,Global Innovation Index,https://www.globalinnovationindex.org/analysis-indicator,,,0,,0,,0,Sub-Pillar,Score,
6.3.1,"Intellectual property receipts, % total trade",1,,0,"Charges for the use of intellectual property (i.e., receipts) as a percentage of total trade.","World Trade Organization, Trade in Commercial Services database.",https://www.imf.org/external/pubs/ft/bop/2007/pdf/bpm6.pdf; www.oecd.org/std/its/EBOPS-2010.pdf,,,0,,0,,0,hardIndicator,Value,
6.3.2,Production and export complexity,1,,0,"Based on an index that ranks economies according to the diversity and complexity of their export basket. High complexity countries are home to a range of sophisticated, specialized capabilities and are therefore able to produce a highly diversified set of complex products.","The Atlas of Economic Complexity, Growth Lab at Harvard University.",https://atlas.cid.harvard.edu,,,0,,0,,0,hardIndicator,Score,
6.3.3,"High-tech exports, % total trade",1,,0,High-technology exports as a percentage of total trade.,"World Trade Organization, United Nations, Comtrade database; Eurostat; and Trade Data Monitor (TDM).",http://comtrade.un.org/; https://tradedatamonitor.com; https://ec.europa.eu/eurostat/cache/metadata/Annexes/htec_esms_an5.pdf,,,0,,0,,0,hardIndicator,Value,
6.3.4,"ICT services exports, % total trade",1,,0,"Telecommunications, computer and information services as a percentage of total trade.","World Trade Organization, Trade in Commercial Services database.",https://www.imf.org/external/pubs/ft/bop/2007/pdf/bpm6.pdf; www.oecd.org/std/its/EBOPS-2010.pdf,,,0,,0,,0,hardIndicator,Value,
7.1.,Intangible assets,1,,0,Sub-pillar on intangible assets.,Global Innovation Index,https://www.globalinnovationindex.org/analysis-indicator,,,0,,0,,0,Sub-Pillar,Score,
7.1.1,Trademarks by origin/bn PPP$ GDP,1,,0,Number of classes in resident trademark applications issued at a given national or regional office (per billion PPP$ GDP),"World Intellectual Property Organization, Intellectual Property Statistics.",www.wipo.int//ipstats,,,0,,0,,0,hardIndicator,Value,
7.1.2,"Global brand value, top 5,000, % GDP",1,,0,"Sum of global brand values of the top 5,000 brands as a percentage of GDP.",Brand Finance,https://brandirectory.com; https://brandfinance.com/knowledge-centre ,,,0,,0,,0,hardIndicator,Value,
7.1.3,Industrial designs by origin/bn PPP$ GDP,1,,0,Number of designs contained in industrial design applications filed at a given national or regional office (per billion PPP$ GDP). Industrial designs are exclusive rights that protect the ornamental or aesthetic aspect of products.,"World Intellectual Property Organization, Intellectual Property Statistics.",www.wipo.int//ipstats,,,0,,0,,0,hardIndicator,Value,
7.1.4,ICTs and organizational model creation†,1,,0,"Average answer to the question: In your country, to what extent do ICTs enable new organizational models (e.g., virtual teams, remote working, telecommuting) within companies? [1 = not at all; 7 = to a great extent]","World Economic Forum, Executive Opinion Survey 2019.",www3.weforum.org/docs/WEF_GCR_2019_Appendix_B.pdf ,,,0,,0,,0,surveyIndicator,Score,
7.2.,Creative goods and services,1,,0,Sub-pillar on creative goods and services.,Global Innovation Index,https://www.globalinnovationindex.org/analysis-indicator,,,0,,0,,0,Sub-Pillar,Score,
7.2.1,"Cultural and creative services exports, % total trade",1,,0,Creative services exports as a percentage of total exports according to the Extended Balance of Payments Services Classification EBOPS 2010.,"World Trade Organization, Trade in Commercial Services database.",https://timeseries.wto.org,,,0,,0,,0,hardIndicator,Value,
7.2.2,National feature films/mn pop. 15–69,1,,0,Number of national feature films produced per million population aged 15–69 years old.,UNESCO Institute for Statistics (UIS) online database.,http://data.uis.unesco.org,,,0,,0,,0,hardIndicator,Value,
7.2.3,Entertainment and media market/th pop. 15–69,1,,0,Consumer and advertising spending per thousand population aged 15–69 years old.,"PwC, Global Entertainment and Media Outlook.",http://www.pwc.com/outlook,,,0,,0,,0,hardIndicator,Score,
7.2.4,"Printing and other media, % manufacturing",1,,0,Printing and reproduction of recorded media output as a percentage of total manufacturing output.,"United Nations Industrial Development Organization, Industrial Statistics Database.",https://stat.unido.org,,,0,,0,,0,hardIndicator,Value,
7.2.5,"Creative goods exports, % total trade",1,,0,Total value of creative goods exports (current US$) over total trade.,"United Nations, Comtrade database; 2009 UNESCO Framework for Cultural Statistics, Table 3, International trade of cultural goods and services based on the 2007 Harmonised System (HS 2007); World Trade Organization, Trade in Commercial Services database, itself based on the sixth (2009) edition of the International Monetary Fund’s Balance of Payments and International Investment Position Manual and Balance of Payments database.",http://comtrade.un.org; http://uis.unesco.org/sites/default/files/documents/measuring-cultural-participation-2009-unesco-framework-for-cultural-statistics-handbook-2-2012-en.pdf; https://www.wto.org/english/res_e/statis_e/tradeserv_stat_e.htm; https://www.oecd.org/sdd/its/EBOPS-2010.pdf,,,0,,0,,0,hardIndicator,Value,
7.3.,Online creativity,1,,0,Sub-pillar on online creativity.,Global Innovation Index,https://www.globalinnovationindex.org/analysis-indicator,,,0,,0,,0,Sub-Pillar,Score,
7.3.1,Generic top-level domains (TLDs)/th pop. 15–69,1,,0,"Generic top-level domains (e.g. .biz, .info, .org, .net and .com) per thousand population aged 15–69 years old.",ZookNIC Inc.,www.zooknic.com,,,0,,0,,0,hardIndicator,Score,
7.3.2,Country-code TLDs/th pop. 15–69,1,,0,"Country-code top-level domains (e.g. .ch, .de, .fr) per thousand population aged 15–69 years old.",ZookNIC Inc.,www.zooknic.com,,,0,,0,,0,hardIndicator,Score,
7.3.3,Wikipedia edits/mn pop. 15–69,1,,0,Wikipedia yearly page edits per million population aged 15–69 years old.,Wikimedia Foundation.,https://wikimediafoundation.org,,,0,,0,,0,hardIndicator,Value,
7.3.4,Mobile app creation/bn PPP$ GDP,1,,0,"Global downloads of mobile apps, by origin of the headquarters of the developer/firm, scaled by PPP$ GDP (billions).",App Annie Intelligence.,https://www.appannie.com,,,0,,0,,0,hardIndicator,Score,
IN.1.1,,0,Political environment,1,Sub-pillar on the political environment of an economy.,,,SubPillar,Institutional environment,1,Institutional environment,1,Institutional environment,1,,Score,2022→2023: 'Political environment' → 'Institutional environment'
IN.1.2,,0,Regulatory environment,1,Sub-pillar on the regulatory environment of an economy.,,,SubPillar,Regulatory environment,1,Regulatory environment,1,Regulatory environment,1,,Score,
IN.1.3,,0,Business environment,1,Sub-pillar on the business environment of an economy.,,,SubPillar,Business environment,1,Business environment,1,Business environment,1,,Score,
IN.2.1,,0,Education,1,Sub-pillar on an economy's education.,,,SubPillar,Education,1,Education,1,Education,1,,Score,
IN.2.2,,0,Tertiary education,1,Sub-pillar on an economy's tertiary education.,,,SubPillar,Tertiary education,1,Tertiary education,1,Tertiary education,1,,Score,
IN.2.3,,0,Research and development (R&D),1,Sub-pillar on the amount of research and development (R&D) performed. ,,,SubPillar,Research and development (R&D),1,Research and development (R&D),1,Research and development (R&D),1,,Score,
IN.3.1,,0,Information and communication technologies (ICTs),1,Sub-pillar on information and communication technologies (ICTs).,,,SubPillar,Information and communication technologies (ICTs),1,Information and communication technologies (ICTs),1,Information and communication technology (ICT),1,,Score,2024→2025: 'Information and communication ' → 'Information and communication '
IN.3.2,,0,General infrastructure,1,Sub-pillar on an economy's general infrastructure.,,,SubPillar,General infrastructure,1,General infrastructure,1,General infrastructure,1,,Score,
IN.3.3,,0,Ecological sustainability,1,Sub-pillar on ecological sustainability.,,,SubPillar,Ecological sustainability,1,Ecological sustainability,1,Ecological sustainability,1,,Score,
IN.4.1,,0,Credit,1,Sub-pillar on credit.,,,SubPillar,Credit,1,Credit,1,Credit,1,,Score,
IN.4.2,,0,Investment,1,Sub-pillar on investment.,,,SubPillar,Investment,1,Investment,1,Investment,1,,Score,
IN.4.3,,0,"Trade, diversification, and market scale",1,"Sub-pillar on trade, diversification, and market scale.",,,SubPillar,"Trade, diversification, and market scale",1,"Trade, diversification and market scale",1,"Trade, diversification and market scale",1,,Score,"2023→2024: 'Trade, diversification, and ma' → 'Trade, diversification and mar'"
IN.5.1,,0,Knowledge workers,1,Sub-pillar on knowledge workers.,,,SubPillar,Knowledge workers,1,Knowledge workers,1,Knowledge workers,1,,Score,
IN.5.2,,0,Innovation linkages,1,Sub-pillar on innovation linkages.,,,SubPillar,Innovation linkages,1,Innovation linkages,1,Innovation linkages,1,,Score,
IN.5.3,,0,Knowledge absorption,1,Sub-pillar on an economy's knowledge absorption capacity.,,,SubPillar,Knowledge absorption,1,Knowledge absorption,1,Knowledge absorption,1,,Score,
OUT.6.1,,0,Knowledge creation,1,Sub-pillar on knowledge creation.,,,SubPillar,Knowledge creation,1,Knowledge creation,1,Knowledge creation,1,,Score,
OUT.6.2,,0,Knowledge impact,1,Sub-pillar on knowledge impact.,,,SubPillar,Knowledge impact,1,Knowledge impact,1,Knowledge impact,1,,Score,
OUT.6.3,,0,Knowledge diffusion,1,Sub-pillar on the diffusion of knowledge.,,,SubPillar,Knowledge diffusion,1,Knowledge diffusion,1,Knowledge diffusion,1,,Score,
OUT.7.1,,0,Intangible assets,1,Sub-pillar on intangible assets.,,,SubPillar,Intangible assets,1,Intangible assets,1,Intangible assets,1,,Score,
OUT.7.2,,0,Creative goods and services,1,Sub-pillar on creative goods and services.,,,SubPillar,Creative goods and services,1,Creative goods and services,1,Creative goods and services,1,,Score,
OUT.7.3,,0,Online creativity,1,Sub-pillar on online creativity.,,,SubPillar,Online creativity,1,Online creativity,1,Online creativity,1,,Score,
IN.1.1.1,,0,Political and operational stability,1,"Index that measures the likelihood and severity of political, legal, operational or security risks affecting business operations. Scores are annualized, standardized and aggregated for end Q1, Q2, Q3 and Q4.",IHS Markit,https://ihsmarkit.com/industry/economics-country-risk.html,Indicator,Operational stability for businesses,1,Operational stability for businesses*,1,Operational stability for businesses*,1,Index,Score,2022→2023: 'Political and operational stab' → 'Operational stability for busi'; 2023→2024: 'Operational stability for busi' → 'Operational stability for busi'
IN.1.1.2,,0,Government effectiveness,1,"Index that reflects perceptions of the quality of public services, the quality of the civil service and the degree of its independence from political pressures, the quality of policy formulation and implementation, and the credibility of the government's commitment to such policies. Scores are standardized.","World Bank, Worldwide Governance Indicators",http://info.worldbank.org/governance/wgi,Indicator,Government effectiveness,1,Government effectiveness*,1,Government effectiveness*,1,Index,Score,2023→2024: 'Government effectiveness' → 'Government effectiveness*'
IN.1.2.1,,0,Regulatory quality,1,Index that reflects perceptions of the ability of the government to formulate and implement sound policies and regulations that permit and promote private-sector development. Scores are standardized.,"World Bank, Worldwide Governance Indicators",http://info.worldbank.org/governance/wgi,Indicator,Regulatory quality,1,Regulatory quality*,1,Regulatory quality*,1,Index,Score,2023→2024: 'Regulatory quality' → 'Regulatory quality*'
IN.1.2.2,,0,Rule of law,1,"Index that reflects perceptions of the extent to which agents have confidence in and abide by the rules of society, and in particular the quality of contract enforcement, property rights, the police and the courts, as well as the likelihood of crime and violence. Scores are standardized.","World Bank, Worldwide Governance Indicators",http://info.worldbank.org/governance/wgi,Indicator,Rule of law,1,Rule of law*,1,Rule of law*,1,Index,Score,2023→2024: 'Rule of law' → 'Rule of law*'
IN.1.2.3,,0,Cost of redundancy dismissal,1,"Redundancy costs measure the cost of advance notice requirements and severance payments due when terminating a redundant worker's employment, expressed in weeks of salary. The average value of notice requirements and severance payments applicable to a worker with 1 year of tenure, a worker with 5 years, and a worker with 10 years are considered. One month is recorded as 4 and 1/3 weeks. If the redundancy cost adds up to 8 or fewer weeks of salary, a value of 8 is assigned but the actual number of weeks is published. If the cost adds up to more than 8 weeks of salary, the score is the number of weeks.","World Bank, Employing Workers Project",https://www.worldbank.org/en/research/employing-workers,Indicator,Cost of redundancy dismissal,1,,0,,0,Data,Value,
IN.1.3.1,,0,Policies for doing business,1,"Average answer to the survey question: In your country, to what extent does the government ensure a stable policy environment for doing business? [1 = not at all; 7 = to a great extent].","World Economic Forum, Executive Opinion Survey (EOS)",https://www.weforum.org/,Indicator,Policies for doing business,1,Policy stability for doing business†,1,Policy stability for doing business†,1,Survey,Score,2023→2024: 'Policies for doing business' → 'Policy stability for doing bus'
IN.1.3.2,,0,Entrepreneurship policies and culture,1,"Average perception scores (five-year average) of experts on entrepreneurial policies and entrepreneurial culture (Items B, C, and I3&I4 of the GEM National Expert Survey). Experts in different fields (purposive sampling, minimum 36 experts per year) assess conditions for entrepreneurship in their country via statements (1=completely false; 10 = completely true). Country participation in GEM varies and therefore the number of experts and years on which this item is based differs according to country.",Global Entrepreneurship Monitor,https://www.gemconsortium.org/wiki/1142,Indicator,Entrepreneurship policies and culture,1,Entrepreneurship policies and culture†,1,Entrepreneurship policies and culture†,1,Index,Score,2023→2024: 'Entrepreneurship policies and ' → 'Entrepreneurship policies and '
IN.2.1.1,,0,"Expenditure on education, % GDP",1,"Total general (local, regional and central) government expenditure on education (current, capital and transfers), expressed as a percentage of GDP. It includes expenditure funded by transfers from international sources to government.",UNESCO Institute for Statistics,http://data.uis.unesco.org,Indicator,"Expenditure on education, % GDP",1,"Expenditure on education, % GDP",1,"Expenditure on education, % GDP",1,Data,Value,
IN.2.1.2,,0,"Government funding/pupil, secondary, % GDP/cap",1,"Average total (current, capital and transfers) general government expenditure per student, at secondary level, expressed as a percentage of GDP per capita.",UNESCO Institute for Statistics,http://data.uis.unesco.org,Indicator,"Government funding/pupil, secondary, % GDP/cap",1,"Government funding/pupil, secondary, % GDP/cap",1,"Government funding/pupil, secondary, % GDP/cap",1,Data,Value,
IN.2.1.3,,0,"School life expectancy, years",1,"Total number of years that a person of school entrance age can expect to spend within the primary to tertiary levels of education. For a child of a given age, the school life expectancy is calculated as the sum of the age-specific enrolment rates for primary to tertiary levels of education. The part of the enrolment that is not distributed by age is divided by the school-age population for the primary to tertiary level of education in which they are enrolled and multiplied by the duration of that level of education. The result is then added to the sum of the age-specific enrolment rates. A relatively high value indicates a greater probability of children spending more years in education and a higher overall retention rate within the education system. It must be noted that the expected number of years does not  necessarily coincide with the expected number of grades of education completed due to grade repetition.",UNESCO Institute for Statistics,http://data.uis.unesco.org,Indicator,"School life expectancy, years",1,"School life expectancy, years",1,"School life expectancy, years",1,Data,Value,
