NUM,NAME_2021,EXISTE_2021,NAME_2022,EXISTE_2022,DESCRIPTION,SOURCE,WEBSITE,LEVEL,NAME_2023,EXISTE_2023,NAME_2024,EXISTE_2024,NAME_2025,EXISTE_2025,TYPE,PROFILE,NOTAS_CAMBIO
IN.2.1.4,,0,"PISA scales in reading, maths and science",1,"PISA is the OECD's (Organisation for Economic Co-operation and Development) Programme for International Student Assessment. PISA measures 15-year-olds' ability to use their reading, mathematics and science knowledge skills. Results from PISA indicate the quality and equity of learning outcomes attained around the world. The 2018 PISA survey is the seventh round of the triennial assessment.\nThe indicator is built using the average of the reading, mathematics and science scores for each country. PISA scores are set in relation to the variation in results observed across all test participants in a country. There is, theoretically, no minimum or maximum score in PISA; rather, the results are scaled to fit approximately normal distributions, with means around 500 score points and standard deviations around 100 score points.\nThe 2018 scores for China correspond to the provinces/municipalities of Beijing, Shanghai, Jiangsu and Zhejiang only. The 2018 scores for Azerbaijan correspond only to the capital Baku. The 2018 average scores for Spain are based only on the scores for mathematics and science, as the reading scores were not published by the OECD due to implausible student response behavior.","OECD, PISA",https://www.oecd.org/pisa/,Indicator,"PISA scales in reading, maths and science",1,"PISA scales in reading, maths and science",1,"PISA scales in reading, maths and science",1,Data,Value,
IN.2.1.5,,0,"Pupil-teacher ratio, secondary",1,"The number of pupils enrolled in secondary school divided by the number of secondary school teachers (regardless of their teaching assignment). Where the data are missing for the secondary education level as a whole, the ratios for upper-secondary are reported; if these are also missing, the ratios for lower-secondary are reported instead. A high pupil–teacher ratio suggests that each teacher has to be responsible for a large number of pupils. In other words, the higher the pupil–teacher ratio, the lower the relative access of pupils to teachers.",UNESCO Institute for Statistics,http://data.uis.unesco.org,Indicator,"Pupil-teacher ratio, secondary",1,"Pupil–teacher ratio, secondary",1,"Pupil–teacher ratio, secondary",1,Data,Value,"2023→2024: 'Pupil-teacher ratio, secondary' → 'Pupil–teacher ratio, secondary'"
IN.2.2.1,,0,"Tertiary enrolment, % gross",1,"The ratio of total tertiary enrolment, regardless of age, to the population of the age group that officially corresponds to the tertiary level of education. Tertiary education, whether or not at an advanced research qualification level, normally requires, as a minimum condition of admission, the successful completion of education at the secondary level. The school enrolment ratio can exceed 100 percent due to grade repetition and the inclusion of under-aged and over-aged students, who are early or late entrants.",UNESCO Institute for Statistics,http://data.uis.unesco.org,Indicator,"Tertiary enrolment, % gross",1,"Tertiary enrolment, % gross",1,"Tertiary enrolment, % gross",1,Data,Value,
IN.2.2.2,,0,"Graduates in science and engineering, %",1,"The share of all tertiary-level graduates in natural sciences, mathematics, statistics, information and technology, manufacturing, engineering and construction as a percentage of all tertiary-level graduates.",UNESCO Institute for Statistics; Eurostat; OECD,http://data.uis.unesco.org; https://ec.europa.eu/eurostat/data/database; https://stats.oecd.org/Index.aspx?DataSetCode=MSTI_PUB,Indicator,"Graduates in science and engineering, %",1,"Graduates in science and engineering, %",1,"Graduates in science and engineering, %",1,Data,Value,
IN.2.2.3,,0,"Tertiary inbound mobility, %",1,The number of students from abroad studying in a given country as a percentage of the total tertiary-level enrolment in that country.,UNESCO Institute for Statistics,http://data.uis.unesco.org,Indicator,"Tertiary inbound mobility, %",1,"Tertiary inbound mobility, %",1,"Tertiary inbound mobility, %",1,Data,Value,
IN.2.3.1,,0,"Researchers, FTE/mn pop.",1,"Researchers in R&D are professionals engaged in the conception or creation of new knowledge. They conduct research and improve or develop concepts, theories, models, techniques, instrumentation, software or operational methods.",UNESCO Institute for Statistics; Eurostat; OECD; RICYT,http://data.uis.unesco.org; https://ec.europa.eu/eurostat/data/database; https://stats.oecd.org/Index.aspx?DataSetCode=MSTI_PUB; http://www.ricyt.org/en/,Indicator,"Researchers, FTE/mn pop.",1,"Researchers, FTE/mn pop.",1,"Researchers, FTE/mn pop.",1,Data,Value,
IN.2.3.2,,0,"Gross expenditure on R&D, % GDP",1,"Gross expenditure on R&D (GERD) is the total domestic intramural expenditure on R&D during a given period as a percentage of GDP. ""Intramural R&D expenditure"" is all expenditure for R&D performed within a statistical unit or sector of the economy during a specific period, regardless of the source of funding.",UNESCO Institute for Statistics; Eurostat; OECD; RICYT,http://data.uis.unesco.org; https://ec.europa.eu/eurostat/data/database; https://stats.oecd.org/Index.aspx?DataSetCode=MSTI_PUB; http://www.ricyt.org/en/,Indicator,"Gross expenditure on R&D, % GDP",1,"Gross expenditure on R&D, % GDP",1,"Gross expenditure on R&D, % GDP",1,Data,Value,
IN.2.3.3,,0,"Global corporate R&D investors, top 3, mn USD",1,"Average expenditure on R&D of the top three global companies. If a country has fewer than three global companies listed, the figure is either the average of the sum of the two companies listed or the total for a single listed company. A score of 0 is given to countries with no listed companies. The data include economies outside the European Union (EU).",European Commission\'s Joint Research Centre,https://iri.jrc.ec.europa.eu/scoreboard/2021-eu-industrial-rd-investment-scoreboard,Indicator,"Global corporate R&D investors, top 3, mn US$",1,"Global corporate R&D investors, top 3, mn USD",1,"Global corporate R&D investors, top 3, mn USD",1,Data,Score,2022→2023: 'Global corporate R&D investors' → 'Global corporate R&D investors'; 2023→2024: 'Global corporate R&D investors' → 'Global corporate R&D investors'
IN.2.3.4,,0,"QS university ranking, top 3",1,"Average score of the top three universities per country. If fewer than three universities are listed in the QS ranking of the global top 1,000 universities, the sum of the scores of the listed universities is divided by three, thus implying a score of zero for the non-listed universities. The 2022 ranking corresponds to data published in June 2021.",QS Quacquarelli Symonds Ltd,https://www.topuniversities.com/university-rankings/world-university-rankings/2022,Indicator,"QS university ranking, top 3",1,"QS university ranking, top 3*",1,"QS university ranking, top 3*",1,Index,Score,"2023→2024: 'QS university ranking, top 3' → 'QS university ranking, top 3*'"
IN.3.1.1,,0,ICT access,1,"The ICT access index is a composite index that assigns weights to four ICT indicators (25 percent each): (1) Percentage of the population covered by mobile networks (at least 3G, at least LTE/WiMax); (2) Mobile cellular telephone subscriptions per 100 inhabitants; (3) International internet bandwith (bit/s) per internet user; and (4) Percentage of households with internet access.",World Intellectual Property Organization,https://www.wipo.int/; https://www.itu.int/en/ITU-D/Statistics/Pages/publications/wtid.aspx,Indicator,ICT access,1,ICT access*,1,ICT access*,1,Index,Score,2023→2024: 'ICT access' → 'ICT access*'
IN.3.1.2,,0,ICT use,1,The ICT use index is a composite index that assigns weights to four ICT indicators (25 percent each): (1) Percentage of individuals using the internet; (2) Fixed (wired) broadband internet subscriptions per 100 inhabitants; (3) Active mobile broadband subscriptions per 100 inhabitants; and (4) Mobile broadband internet traffic (gigabytes/subscriptions).,World Intellectual Property Organization,https://www.wipo.int/; https://www.itu.int/en/ITU-D/Statistics/Pages/publications/wtid.aspx,Indicator,ICT use,1,ICT use*,1,ICT use*,1,Index,Score,2023→2024: 'ICT use' → 'ICT use*'
IN.3.1.3,,0,Government's online service,1,"The Online Services Index component of the E-Government Development Index is a composite indicator measuring the use of ICTs by governments in delivering public services at the national level. To arrive at a set of Online Service Index values for 2020, a total of 215 online United Nations Volunteer researchers from 96 countries, covering 66 languages, undertook an E-Government Survey that assessed each country's national website in the native language, including the national portal, e-services portal and e-participation portal, as well as the websites of the related ministries of education, labor, social services, health, finance and environment, as applicable. The total number of points scored by each country is normalized to a range of 0 to 1. The online index value for a given country is equal to the actual total score less the lowest total score divided by the range of total score values for all countries.\nNote: The precise meaning of these values varies from one edition of the Survey to the next, as understanding of the potential of e-government changes and the underlying technology evolves.","Division for Public Administration and Development Management (DPADM), United Nations Department of Economic and Social Affairs (DESA).",https://publicadministration.un.org/egovkb/en-us/Reports/UN-E-Government-Survey-2020,Indicator,Government's online service,1,Government's online service*,1,Government online service*,1,Index,Score,2023→2024: 'Government's online service' → 'Government's online service*'; 2024→2025: 'Government's online service*' → 'Government online service*'
IN.3.1.4,,0,E-participation,1,"The E-Participation Index (EPI) is derived as a supplementary index to the United Nations E-Government Survey. It extends the scope of the Survey by focusing on government use of online services in providing information to its citizens (""e-information sharing""), interacting with stakeholders (""e-consultation"") and engaging in decision-making processes (""e-decision-making""). A country's EPI reflects the e-participation mechanisms that are deployed by its government in comparison to all other countries. The purpose of this measure is not to prescribe any specific practice, but rather to offer insight into how different countries are using online tools to promote interaction between government and citizens, as well as between citizens, for the benefit of all. As the EPI is a qualitative assessment based on the availability and relevance of participatory services on government websites, the comparative ranking of countries is for illustrative purposes only and serves as an indicator of the broad trends in promoting citizen engagement. The index ranges from 0 to 1, with 1 showing greater e-participation. Mathematically, the EPI is normalized by taking the total score value for a given country, subtracting the lowest total score for any country in the survey and dividing by the range of total score values for all countries.\nNote: The precise meaning of these values varies from one edition of the Survey to the next, as understanding of the potential of e-government changes and the underlying technology evolves.","Division for Public Administration and Development Management (DPADM), United Nations Department of Economic and Social Affairs (DESA).",https://publicadministration.un.org/egovkb/en-us/Reports/UN-E-Government-Survey-2020,Indicator,E-participation,1,E-participation*,1,,0,Index,Score,2023→2024: 'E-participation' → 'E-participation*'
IN.3.2.1,,0,"Electricity output, GWh/mn pop.",1,"Electricity production, measured at the terminals of all alternator sets in a station. In addition to hydropower, coal, oil, gas and nuclear power generation, this indicator covers generation by geothermal, solar, wind, tide and wave energy, as well as that from combustible renewables and waste. Production includes the output of plants that are designed to produce solely electricity as well as the output of combined heat and power plants. Electricity output in GWh is scaled by population.",International Energy Agency,https://www.iea.org/reports/world-energy-balances-overview,Indicator,"Electricity output, GWh/mn pop.",1,"Electricity output, GWh/mn pop.",1,"Electricity output, GWh/mn pop.",1,Data,Value,
IN.3.2.2,,0,Logistics performance,1,"A multidimensional assessment of logistics performance, the Logistics Performance Index (LPI) ranks 160 countries, combining data on six core performance components into a single aggregate measure that includes customs performance, infrastructure quality and timeliness of shipments. The data used in the ranking come from a survey of logistics professionals who are asked questions about the foreign countries in which they operate. The LPI's six components are: (1) Customs: the efficiency of customs and border management clearance; (2) Infrastructure: the quality of trade and transport infrastructure; (3) International shipments: the ease of arranging competitively priced shipments; (4) Services quality: the competence and quality of logistics services; (5) Tracking and tracing: the ability to track and trace consignments; and (6) Timeliness: the frequency with which shipments reach consignees within scheduled or expected delivery times. The LPI therefore consists of both qualitative and quantitative measures and helps to build profiles of logistics friendliness for these countries.","Logistics Performance Index, World Bank; Arvis et al., 2018",https://lpi.worldbank.org/;https://openknowledge.worldbank.org/handle/10986/29971,Indicator,Logistics performance,1,Logistics performance*,1,Logistics performance*,1,Index,Score,2023→2024: 'Logistics performance' → 'Logistics performance*'
IN.3.2.3,,0,"Gross capital formation, % GDP",1,"Gross capital formation is expressed as the ratio of total investment in current local currency to GDP in current local currency. Investment or gross capital formation is measured by the total value of the gross fixed capital formation and changes in inventories and acquisitions less disposals of valuables for a unit or sector, on the basis of the System of National Accounts (SNA) 1993.",International Monetary Fund,https://www.imf.org/en/Publications/WEO/weo-database/2021/October,Indicator,"Gross capital formation, % GDP",1,"Gross capital formation, % GDP",1,"Gross capital formation, % GDP",1,Data,Value,
IN.3.3.1,,0,GDP/unit of energy use,1,Purchasing power parity gross domestic product (2015 PPP$ GDP) per total energy supply (TES). TES is made up of the cost of production + imports − exports − international marine bunkers − international aviation bunkers +/– stock changes. GDP/TES is an indicator of energy productivity.,International Energy Agency,https://www.iea.org/reports/world-energy-balances-overview,Indicator,GDP/unit of energy use,1,GDP/unit of energy use,1,GDP/unit of energy use,1,Data,Value,
IN.3.3.2,,0,Environmental performance,1,"The 2022 Environmental Performance Index (EPI) ranks 180 countries on different  categories covering environmental health and ecosystem vitality. These indicators provide a gauge of how close countries are to achieving established environmental policy targets. The EPI offers a scorecard that highlights leaders and laggards in environmental performance and provides practical guidance for countries that aspire to move toward a sustainable future. The index ranges from 0 to 100, with 100 indicating best performance.",Yale University,https://epi.yale.edu/,Indicator,Environmental performance,1,"Low-carbon energy use, %",1,"Low-carbon energy use, %",1,Index,Score,"2023→2024: 'Environmental performance' → 'Low-carbon energy use, %'"
IN.3.3.3,,0,ISO 14001 environmental certificates/bn PPP$ GDP,1,"ISO 14001 specifies the requirements for an environmental management system that an organization can use to enhance its environmental performance. ISO 14001 is intended for use by an organization that is seeking to manage its environmental responsibilities in a systematic manner that contributes to the environmental pillar of sustainability. ISO 14001 helps an organization to achieve the intended outcomes of its environmental management system, providing value for the environment, the organization itself and interested parties. Consistent with the organization's environmental policy, the intended outcomes of an environmental management system include enhancement of environmental performance, fulfillment of compliance obligations and achievement of environmental objectives. ISO 14001 is applicable to any organization, regardless of size, type or nature, and applies to the environmental aspects of its activities, products and services that the organization determines it can either control or influence from a life cycle perspective. ISO 14001 does not state specific environmental performance criteria. It can be used in whole or in part to systematically improve environmental management. Claims of conformity to ISO 14001, however, are not acceptable unless all its requirements are incorporated into an organization's environmental management system and fulfilled without exclusion. The data are reported per billion PPP$ GDP.",International Organization for Standardization; International Monetary Fund,https://www.imf.org/en/Publications/WEO/weo-database/2021/October,Indicator,ISO 14001 environment/bn PPP$ GDP,1,ISO 14001 environment/bn PPP$ GDP,1,ISO 14001 environment/bn PPP$ GDP,1,Data,Value,2022→2023: 'ISO 14001 environmental certif' → 'ISO 14001 environment/bn PPP$ '
IN.4.1.1,,0,Finance for startups and scaleups,1,"Average perception scores (five-year average) of experts on finance for starting and growing firms (item A of the GEM National Expert Survey). Experts in different fields (purposive sampling, minimum 36 experts per year) assess conditions for entrepreneurship in their country via statements (1=completely false; 10 = completely true). Country participation in GEM varies and therefore the number of experts and years on which this item is based differs according to country.",Global Entrepreneurship Monitor,https://www.gemconsortium.org/wiki/1142,Indicator,Finance for startups and scaleups,1,Finance for startups and scaleups†,1,Finance for startups and scaleups†,1,Index,Score,2023→2024: 'Finance for startups and scale' → 'Finance for startups and scale'
IN.4.1.2,,0,"Domestic credit to private sector, % GDP",1,"Domestic credit to private sector refers to financial resources provided to the private sector by financial corporations, such as through loans, purchases of non-equity securities, and trade credits and other accounts receivable, that establish a claim for repayment. For some countries, these claims include credit to public enterprises. The financial corporations include monetary authorities and deposit money banks, as well as other financial corporations where data are available (including corporations that do not allow transferable deposits but do accept such liabilities as time and savings deposits). Examples of other financial corporations are finance and leasing companies, money lenders, insurance corporations, pension funds and foreign exchange companies.",International Monetary Fund; World Bank,https://data.imf.org; https://databank.worldbank.org/source/world-development-indicators,Indicator,"Domestic credit to private sector, % GDP",1,"Domestic credit to private sector, % GDP",1,"Domestic credit to private sector, % GDP",1,Data,Value,
IN.4.1.3,,0,"Loans from microfinance institutions, % GDP",1,Outstanding loans from all microfinance institutions in a country as a percentage of its GDP.,"International Monetary Fund, Financial Access Survey (FAS)",https://data.imf.org/?sk=E5DCAB7E-A5CA-4892-A6EA-598B5463A34C,Indicator,"Loans from microfinance institutions, % GDP",1,"Loans from microfinance institutions, % GDP",1,"Loans from microfinance institutions, % GDP",1,Data,Value,
IN.4.2.1,,0,"Market capitalization, % GDP",1,"Market capitalization (also known as ""market value"") is the share price times the number of shares outstanding (including their several classes) for listed domestic companies. Investment funds, unit trusts and companies whose only business goal is to hold shares of other listed companies are excluded. Data are the average of the end-of-year values for the last three years.",World Federation of Exchanges; World Bank,https://www.world-exchanges.org/our-work/statistics; https://databank.worldbank.org/source/world-development-indicators,Indicator,"Market capitalization, % GDP",1,"Market capitalization, % GDP",1,"Market capitalization, % GDP",1,Data,Value,
IN.4.2.2,,0,"Venture capital investors, deals/bn PPP$ GDP",1,"Refinitiv data on private equity deals, per deal, with information on the location of the firm investing in a venture capital (VC) deal, among other details. The data extraction corresponds to a query on VC deals between January 1, 2019 and December 31, 2021, with the data aggregated by the location of the investing firm. The data represent the three-year average of 2019–21 deals invested in and are reported per billion PPP$ GDP.",Refinitiv; International Monetary Fund,https://solutions.refinitiv.com/eikon-trading-software; https://www.imf.org/en/Publications/WEO/weo-database/2021/October,Indicator,"Venture capital (VC) investors, deals/bn PPP$ GDP",1,"Venture capital (VC) investors, deals/bn PPP$ GDP",1,"Venture capital (VC) received, deal count/bn PPP$ GDP",1,Data,Value,"2022→2023: 'Venture capital investors, dea' → 'Venture capital (VC) investors'; 2024→2025: 'Venture capital (VC) investors' → 'Venture capital (VC) received,'"
IN.4.2.3,,0,"Venture capital recipients, deals/bn PPP$ GDP",1,"Refinitiv data on private equity deals, per deal, with information on the location of the firm receiving the VC investment, among other details. The data extraction corresponds to a query on VC deals between January 1, 2019 and December 31, 2021, with the data aggregated by the location invested in. The data represent the three-year average of 2019–21 deals received and are reported per billion PPP$ GDP.",Refinitiv; International Monetary Fund,https://solutions.refinitiv.com/eikon-trading-software; https://www.imf.org/en/Publications/WEO/weo-database/2021/October,Indicator,"VC recipients, deals/bn PPP$ GDP",1,"VC recipients, deals/bn PPP$ GDP",1,"Late-stage VC deal count, % global VC",1,Data,Value,"2022→2023: 'Venture capital recipients, de' → 'VC recipients, deals/bn PPP$ G'; 2024→2025: 'VC recipients, deals/bn PPP$ G' → 'Late-stage VC deal count, % gl'"
IN.4.2.4,,0,"Venture capital received, value, % GDP",1,"Refinitiv data on the monetary value of private equity deals, per deal, with information on the location of the firm receiving the VC investment, among other details. The data extraction corresponds to a query on VC deals between January 1, 2019 and December 31, 2021, with the data aggregated by the location invested in. The data represent the three-year average of reported deal value, in current US$ (billions), received and are reported.",Refinitiv; International Monetary Fund,https://solutions.refinitiv.com/eikon-trading-software; https://www.imf.org/en/Publications/SPROLLs/world-economic-outlook-databases,Indicator,"VC received, value, % GDP",1,"VC received, value, % GDP",1,"VC investors, deal count/bn PPP$ GDP",1,Data,Value,"2022→2023: 'Venture capital received, valu' → 'VC received, value, % GDP'; 2024→2025: 'VC received, value, % GDP' → 'VC investors, deal count/bn PP'"
IN.4.2.5,,0,,0,"Indicator that captures VC deals received by investor location, using fractional counting. For each deal, the total is divided equally among all participating investors (i.e., 1/n per investor, where n is the number of investors). The resulting fractions are aggregated by the investors’ country of headquarters. This methodology ensures that the total number of deals is preserved when summing across countries with known investor locations. The data corresponds to VC deals between January 1, 2022, and December 31, 2024. The data represent the three-year average of 2022–24 deals and are reported per billion PPP$ GDP.","PitchBook Data, Inc.; International Monetary Fund",www.pitchbook.com; www.imf.org/en/Publications/WEO/weo-database/2024/October,Indicator,,0,,0,VC investor co-participation/bn PPP$ GDP,1,Data,Value,
IN.4.3.1,,0,"Applied tariff rate, weighted avg., %",1,"Weighted average applied tariff is the average of effectively applied rates weighted by the product import shares corresponding to each partner country. Data are classified using the Harmonized System of trade at the six- or eight-digit level. Tariff line data were matched to Standard International Trade Classification (SITC) Revision 3 codes to define commodity groups and import weights. As far as possible, specific rates have been converted to their ad valorem equivalent rates and have been included in the calculation of weighted average tariffs. Effectively applied tariff rates at the six- and eight-digit product level are averaged for products in each commodity group. When the effectively applied rate is unavailable, the most favored nation rate is used instead. Data extracted from the World Bank's World Development Indicators database.",World Bank,http://data.worldbank.org,Indicator,"Applied tariff rate, weighted avg., %",1,"Applied tariff rate, weighted avg., %",1,"Applied tariff rate, weighted avg., %",1,Data,Value,
